govid|english_name|flags
1319|SPECIAL ZONE OVERSEAS EMPLOYMENT (HONG KONG) LIMITED|similar agency address
1371|Stone Employment Agency|exact agency address,similar agency address,similar agency telephone,similar agency fax,similar money lender address
1390|Space Employment Agency|similar agency address,similar money lender address
1399|FURTHER CREATION EMPLOYMENT CENTRE|exact agency address,similar agency address,similar agency telephone,similar agency fax,similar agency email
1400|FURTHER CREATION EMPLOYMENT CENTRE|exact agency address,similar agency telephone,similar agency fax,similar agency email
1403|STEP ONE EMPLOYMENT AGENCY|similar agency address
1414|WAIKIKI SERVICES & TRADING|similar agency address,similar money lender address
1416|Perfect Maid Centre|similar agency address,similar agency fax
1419|P & P Employment Agency Limited|similar agency address
1426|OSCAR EMPLOYMENT CENTRE|exact agency address,similar agency address
1438|J.C. SO (HONG KONG) RECRUITMENT AGENCY|similar agency address,similar agency email
1445|Asia-Ex Employment Centre|exact agency address,similar agency address,similar agency email
1456|SUPER MAID LIMITED|similar agency address,similar agency email
1461|EVER POWER SERVICE CO.|similar agency address,similar money lender address
1466|NEW WISH EMPLOYMENT AGENCY|exact agency address,similar agency address,similar agency fax
1470|Peony Employment Agency Limited|exact agency address,similar agency address,similar money lender address
1476|FUN FUN SERVICE LIMITED|similar agency address,similar money lender address
1485|MADAM JOE PROFESSIONAL DOMESTIC SERVICES COMPANY|similar agency address,similar money lender address
1496|St. Joseph's Employment Consultants|similar agency address,similar agency fax,similar agency email,similar money lender address
1512|Berkah Employment Consultant Centre|similar agency address,similar money lender address
1528|Top Aid Employment & Travel Services|similar agency address
1539|L AND A EMPLOYMENT AGENCY|similar agency address,similar money lender address
1546|JL Employment Centre|similar agency address,similar agency fax,similar agency email,similar money lender address
1549|LUCKY MAIDS JOB CENTRE|exact agency address,similar agency address,similar agency fax
1552|PRIME-MAID EMPLOYMENT AGENCY|similar agency address,similar money lender address
1565|Job Leader Profession Consultant|similar agency address
1567|TOTAL RICH FUND LIMITED|exact agency address,similar agency address
1574|Fu Yat Employment Company|similar agency address
1576|C & C Oversea Employment Company|similar agency email
1577|C & C Oversea Employment Company|exact agency address,similar agency address,similar agency telephone,similar agency fax,similar agency email
1579|Lotus Employment Agency|similar agency address,similar agency email
1580|Lotus Employment Agency|similar agency address,similar agency email
1581|Lotus Employment Agency|similar agency email
1582|Lotus Employment Agency|similar agency email
1590|Ngai Kan Employment Agency|exact agency address,similar agency address,similar agency telephone,similar agency fax,similar agency email,similar money lender address
1602|Graceful-worker Employment Agency|similar agency address,similar money lender address
1618|ON FAT EMPLOYMENT CO. LIMITED|exact agency address,similar agency address
1624|SHUN FAT EMPLOYMENT CO|exact agency address,similar agency telephone,similar agency email
1630|HOUSE MAID AGENCY LIMITED|similar agency address
1631|HOUSE MAID AGENCY LIMITED|similar agency address,similar money lender address
1644|Prudential Employment Agency|similar agency address
1649|Hong Kong DH Employment Centre|exact agency address,similar agency address,similar agency telephone,similar agency fax,similar agency email
1651|VIVA EMPLOYMENT SERVICES LIMITED|exact agency address,similar agency fax,similar agency email
1653|Dragon Castle Employment Agency Limited|similar agency address,similar agency fax
1664|R.O.A. Personnel and Employment Agency|similar agency address,similar money lender address
1668|PLEASANT HOUSE EMPLOYMENT CENTRE LIMITED|exact agency address
1670|Finished Contract Employment Center|exact agency address,similar agency address
1672|FAN IN EMPLOYMENT AGENCY LIMITED|similar agency address
1673|MRS. HUI EMPLOYMENT AGENCY|exact agency address,similar agency address,similar agency telephone,similar agency email
1674|Hong Kong Maid Agency|similar agency address
1690|MY SWEET HOME EMPLOYMENT AGENCY|similar agency address,similar agency telephone,similar agency fax
1691|WANG FULLCO EMPLOYMENT AGENCY LIMITED|exact agency address,similar agency telephone,similar agency fax
1724|Loyalty Team Employment Agency|similar agency address,similar agency email,similar money lender address
1725|Loyalty Team Employment Agency|similar agency address,similar agency email,similar money lender address
1733|ROYAL HOUSE EMPLOYMENT AGENCY|exact agency address,similar agency address
1737|HAPPY HOUSE EMPLOYMENT AGENCY|exact agency address,similar agency telephone,similar agency fax,similar agency email
1779|GBjobs.com Limited|similar agency address
1796|Bandung Enterprises|similar agency address,similar agency fax,similar agency email
1818|Grand Palace Employment Agency Centre|exact agency address,similar agency address,similar agency telephone,similar agency fax,similar agency email,similar money lender address
1829|FORTUNE STAR EMPLOYMENT AGENCY|exact agency address
1831|WING FAI EMPLOYMENT LIMITED|similar agency address
1843|Island Employment Service Company|similar agency address
1848|MR. RIGHT EMPLOYMENT CENTRE|exact agency address,similar agency address,similar agency fax
1858|NICOLE'S EMPLOYMENT CONSULTANTS|exact agency address,similar agency telephone,similar agency email
1862|JET SYSTEM PACIFIC LIMITED|similar agency address
1876|TOP WORLDWIDE PROFESSIONAL SERVICES CO.|similar agency address,similar money lender address
1882|HO MAN EMPLOYMENT AGENCY|exact agency address,similar agency fax,similar agency email,similar money lender address
1889|NAULI EMPLOYMENT AGENCY COMPANY LIMITED|exact agency address,similar agency telephone,similar agency fax,similar agency email
1892|WAH YING EMPLOYMENT CENTRE|similar agency address
1895|KAMPO EMPLOYMENT AGENCY|similar agency email
1899|THREE STAR EMPLOYMENT AGENCY LIMITED|similar agency address
1920|TOP RESOURCES CONSULTANCY COMPANY|exact agency address,similar agency address,similar agency telephone,similar agency fax
1936|Smart B Employment Service Co.|similar agency address
1941|Mamie Employment Centre Limited|exact agency address,similar agency telephone,similar agency fax,similar agency email
1947|Excel Famous Domestic Helper Consultant Limited|similar agency telephone,similar agency email
1965|Yuk Fai Employment Agency|similar agency address
1968|Yuk Fai Employment Agency|similar agency address
1998|LINK HEART EMPLOYMENT|similar agency address
2001|FAVOR MAID EMPLOYMENT AGENCY|exact agency address,similar agency telephone,similar agency fax,similar agency email
2004|ENDURANCE EMPLOYMENT AGENCY|exact agency address
2007|S & B Employment & Travel Centre|similar agency fax
2009|NEW FORSEE EMPLOYMENT AGENCY|exact agency address,similar agency address,similar agency fax
2016|GRACEFUL TRAVEL COMPANY|exact agency address,similar agency address,similar money lender address
2050|Hong Kong Financial Talent Consultant Company Limited|exact agency address,similar agency address
2052|Hong Kong Financial Talent Consultant Company Limited|exact agency address,similar money lender address
2068|SUKI EMPLOYMENT SERVICE COMPANY|similar agency address
2108|R&E; Employment Agency|similar agency address,similar money lender address
2124|FAI SING (HONG KONG) LIMITED|exact agency address,similar agency telephone,similar agency fax
2129|Unlimited Source Co.|similar agency address
2147|GUARDIAN EMPLOYMENT AGENCY|similar agency address
2153|JOIN-UP|similar agency address,similar money lender address
2154|JOIN-UP|similar agency address,similar money lender address
2156|FIORI MEGA STAR EMPLOYMENT AGENCY LIMITED|exact agency address,similar agency address,similar agency fax,similar agency email
2164|UNITED FAMILY EMPLOYMENT AGENCY|similar agency address,similar agency fax
2170|Easy Maid Employment Agency Limited|similar agency address,similar money lender address
2184|CHAMPION EMPLOYMENT|exact agency address,similar agency address,similar agency telephone,similar agency fax,similar agency email,similar money lender address
2190|BONBON EMPLOYMENT AGENCY CENTRE|similar agency address,similar money lender address
2194|Rising Sun Employment Agency|exact agency address,similar agency address,similar agency fax
2211|Tomato Employment Service Co. Limited|similar agency address
2220|SZE YUEN AGENCY CO|similar agency address,similar money lender address
2221|Dickson Employment Agency|exact agency address
2222|MANDA EMPLOYMENT LIMITED|similar agency address
2232|OEC OVERSEAS EMPLOYMENT CENTRE|similar agency address,similar agency email
2250|HOME CARE EMPLOYMENT AGENCY LIMITED|exact agency address,similar agency address,similar agency telephone,similar agency fax,similar agency email,similar money lender address
2272|CHAN'S ASIA RECRUITMENT CENTRE|similar agency address
2282|HAVE MAID EMPLOYMENT AGENCY|similar agency address,similar money lender address
2289|GRANDE EMPLOYMENT CENTRE|similar agency address,similar money lender address
2292|FIRST CAPITAL RESOURCES GROUP LIMITED|exact agency address,similar agency address,similar agency telephone,similar agency fax,similar agency email
2310|S & P Employment Centre|similar agency address
2319|Wecarehelpers Employment Agency|similar money lender address
2326|VIGOR COMPANY|similar agency address,similar money lender address
2357|FUN TOP EMPLOYMENT SERVICE COMPANY|exact agency address,similar agency address,similar agency telephone,similar agency fax,similar agency email,similar money lender address
2387|KING BEST HOLDINGS LIMITED|similar agency address,similar agency fax
2402|TACKLE STAR|similar agency address,similar agency fax,similar money lender address
2403|CAREGIVER CO.|similar money lender address
2412|Modern Employment Agency Company|similar agency address,similar money lender address
2424|CAREHOUSE EMPLOYMENT COMPANY|similar agency address,similar money lender address
2431|GLORY SKY EMPLOYMENT CO.|similar agency address,similar money lender address
2446|520 Employment Agency|similar agency address,similar money lender address
2455|DIANA Human Resources|exact agency address,similar agency address,similar agency fax
2459|Emperor Tai Po Employment Co.|similar money lender address
2481|MAIDSDOT.COM LIMITED|exact agency address,similar agency fax,similar agency email
2540|MABEL EMPLOYMENT AGENCY|exact agency address,similar agency address,similar money lender address
2549|HELPER SEARCH TECHNOLOGIES LIMITED|similar agency address,similar agency fax
2558|PRICERITE MAID LIMITED|exact agency address,similar agency address
2560|SSP JOYFUL EMPLOYMENT CONSULTANTS|similar agency address
2567|Powerman Employment Limited|similar agency address
2572|HEARTFUL EMPLOYMENT SERVICES (HK) LIMITED|exact agency address,similar agency address,similar agency telephone,similar agency fax
2583|Mission Light Employment Agency|exact agency address
2609|SUN STAR EMPLOYMENT AGENCY|similar agency address,similar money lender address
2621|Vast Sky Employment Limited|similar agency address
2623|Maid Best Limited|exact agency address,similar agency address,similar agency fax,similar agency email
2624|Maid Best Limited|similar agency telephone,similar agency email
2627|A&F; EMPLOYMENT CENTRE|exact agency address,similar agency address,similar agency telephone,similar agency fax,similar agency email
2628|A&F; EMPLOYMENT CENTRE|exact agency address,similar agency address,similar agency telephone,similar agency fax
2629|A&F; EMPLOYMENT CENTRE|exact agency address,similar agency address,similar agency telephone,similar agency fax,similar agency email
2630|A&F; EMPLOYMENT CENTRE|exact agency address,similar agency address,similar agency telephone,similar agency fax,similar money lender address
2641|SMILE LADY EMPLOYMENT AGENCY|similar agency address,similar money lender address
2645|YU FUNG EMPLOYMENT AGENCY|similar agency address
2658|King Master Employment Agency Co.|similar agency address
2667|NF Employment And Trading Co.|similar agency address,similar money lender address
2669|KARRYEN EMPLOYMENT AGENCY|similar agency address
2733|TAKEME EMPLOYMENT AGENCY|similar agency fax
2749|KA YIN EMPLOYMENT CENTRE|similar agency address,similar agency telephone,similar agency fax
2750|KA YIN EMPLOYMENT CENTRE|similar agency address,similar agency telephone,similar agency fax,similar money lender address
2770|Talent (Kenya) Company Limited|similar agency address
2775|Sincere Dragon Employment Centre Limited|similar agency address
2779|Gold Profit Employment Agency|similar agency address,similar money lender address
2789|JOVIAL EMPLOYMENT CENTRE|exact agency address,similar agency address
2796|Hollywood Employment Agency|exact agency address,similar agency address
2836|GOLDEN PEAK EMPLOYMENT AGENCY|exact agency address,similar agency telephone,similar agency fax,similar agency email
2843|Salok Employment Centre Limited|similar agency address
2848|HING LUNG INTERNATIONAL EMPLOYMENT COMPANY|similar agency address
2892|Flourish Employment Agency|similar agency address,similar money lender address
2898|EVERBEST MAIDS EMPLOYMENT AGENCY|similar agency address
2914|The Glory International Employment Agency|similar money lender address
2927|TAYLOR AGENCY CO|similar agency address
2942|SUNNY EMPLOYMENT SERVICE LIMITED|exact agency address,similar money lender address
2944|FORMICA MAID CENTRE|similar agency address,similar money lender address
2959|Gracefield Employment Service Limited|exact agency address,similar agency address,similar agency telephone,similar money lender address
2969|SAG CONSULTANT LIMITED|exact agency address
2979|Good & Good Consultant Top Up Center|exact agency address
2997|Hilljoy Employment|similar agency address,similar money lender address
3040|GOLDEN WIN EMPLOYMENT AGENCY LIMITED|similar agency address
3041|Golden Queen Employment Agency Limited|similar agency address
3048|HONESTY SKYLINE EMPLOYMENT AGENCY|similar agency address
3066|FESDI EMPLOYMENT CENTRE|similar agency address,similar agency telephone,similar agency fax,similar agency email,similar money lender address
3067|FESDI EMPLOYMENT CENTRE|similar agency address,similar money lender address
3070|FESDI EMPLOYMENT CENTRE|similar agency address,similar agency fax
3072|FESDI EMPLOYMENT CENTRE|similar agency address,similar agency telephone,similar agency fax,similar agency email
3077|RCI International Employment Agency Limited|exact agency address,similar agency telephone,similar agency fax
3093|UNIQUE EMPLOYMENT CENTRE LIMITED|exact agency address,similar agency address,similar agency fax
3132|STAR CARE EMPLOYMENT AGENCY|similar agency address,similar agency fax,similar agency email
3133|LINCOLN EMPLOYMENT AGENCY|exact agency address,similar agency address
3135|MAIDSLAND EMPLOYMENT AGENCY|similar agency address,similar agency fax,similar money lender address
3136|MY SWEET HOME EMPLOYMENT AGENCY|similar agency address
3140|INDO-CHINESE EMPLOYMENT LIMITED|similar agency address,similar money lender address
3148|PS ZEST EMPLOYMENT SERVICES AND TRADING CO.|similar agency address,similar money lender address
3174|FABULOUS EMPLOYMENT AGENCY|similar agency address
3202|CITY EMPLOYMENT PARADISE CO.|similar agency address,similar agency fax
3203|CITY EMPLOYMENT PARADISE CO.|exact agency address,similar agency fax
3205|CITY EMPLOYMENT PARADISE CO.|similar agency address,similar money lender address
3206|CITY EMPLOYMENT PARADISE CO.|similar agency address,similar agency telephone,similar agency fax,similar agency email,similar money lender address
3209|TSUEN WAN EMPLOYMENT PARADISE CO.|exact agency address,similar agency address,similar agency telephone,similar agency fax,similar agency email
3212|FAIR CHOICE DOMESTIC HELPER SERVICES|exact agency address,similar agency address
3218|SUKAIKU EMPLOYMENT AGENCY|similar agency address,similar money lender address
3219|IN HEART EMPLOYMENT AGENCY LIMITED|similar agency address,similar agency email
3237|Radiant Maid Agency Service Limited|similar agency address,similar agency telephone,similar agency fax
3248|Genial Employment Centre|similar agency address
3253|Spring Up Overseas Employment Agency Limited|similar agency address
3258|IAAS Consulting Group|exact agency address
3266|Full Moon Employment Agency Limited|similar agency address,similar money lender address
3277|WING MING EMPLOYMENT SERVICES|similar agency telephone
3285|ANCITY EMPLOYMENT CENTRE|similar agency address,similar money lender address
3290|MASTERWELL COMPANY|similar agency address
3292|SAMSON EMPLOYMENT AGENCY|exact agency address,similar agency address
3297|Sunlight Employment Agency|similar agency address,similar money lender address
3300|IN HEART EMPLOYMENT AGENCY LIMITED|similar agency address,similar agency email
3320|ISLAND WEST EMPLOYMENT PARADISE CO.|exact agency address,similar agency fax
3321|O-raiser Employment Agency Company Limited|exact agency address,similar agency address,similar agency fax
3332|THE WING'S EMPLOYMENT AGENCY CO.|similar agency address
3335|LINCOLN EMPLOYMENT AGENCY|similar agency address,similar agency fax,similar money lender address
3343|KING'S ONE EMPLOYMENT AGENCY|similar agency address,similar agency fax
3349|SMOOTH MAID EMPLOYMENT AGENCY LIMITED|exact agency address,similar agency address,similar agency telephone,similar agency fax
3364|Skyway Employment Agency Limited|exact agency address,similar agency address,similar money lender address
3374|Helper Ads Connect Global Co. (HK)|similar agency address
3381|Sunlight Employment Agency|similar agency address,similar money lender address
3383|Best of Best (BOB) Employment Centre|similar agency address,similar agency fax,similar agency email,similar money lender address
3384|TAKEME EMPLOYMENT AGENCY|similar agency address,similar agency fax,similar money lender address
3412|SCENEWAY EMPLOYMENT PARADISE CO.|similar agency address,similar agency telephone,similar agency fax,similar agency email
3422|Great Advance Employment Service Limited|exact agency address,similar agency address
3433|GET ON EMPLOYMENT AGENCY|similar agency address,similar agency email,similar money lender address
3456|SINCERE COMPANY|exact agency address,similar agency address,similar agency email
3457|SINCERE COMPANY|similar agency address,similar agency telephone,similar agency fax,similar agency email
3458|SINCERE COMPANY|similar agency address,similar agency telephone,similar agency fax,similar agency email
3467|DILIGENT EMPLOYMENT|similar agency address,similar agency fax
3470|Guru Employment Services Centre|similar agency address
3479|Pure Employment Center|exact agency address,similar agency telephone
3488|WELL SHINE CO.|similar agency address,similar agency fax,similar agency email
3489|Ensemble Human Resources Co. Limited|similar agency telephone,similar agency fax,similar agency email
3504|WINSOME EMPLOYMENT LIMITED|similar agency address
3507|MING YIP CONSULTANT|similar agency address,similar agency fax
3555|DBBC SERVICES|similar agency address
3568|Yat Li Employment Centre|similar agency address
3575|DAVID CHEUNG EMPLOYMENT AGENCY LIMITED|similar agency telephone
3585|e-Job|exact agency address,similar agency fax
3618|EAST STAR RECRUITMENT|similar agency address,similar agency telephone,similar agency fax
3628|Prime Services & Trading Co|exact agency address,similar agency address
3630|VIVA EMPLOYMENT SERVICES LIMITED|similar agency address,similar agency fax,similar agency email
3631|MY SWEET HOME EMPLOYMENT AGENCY|similar agency address
3632|UNIQUE EMPLOYMENT CENTRE LIMITED|similar agency address
3656|GOLDEN JOY EMPLOYMENT AGENCY LIMITED|similar agency address,similar money lender address
3665|Emma Maids Employment Centre|similar agency address
3668|SAINT KAI EMPLOYMENT SERVICE|exact agency address,similar agency address
3679|GOLDEN WIN EMPLOYMENT AGENCY LIMITED|similar agency address
3681|IN HEART EMPLOYMENT AGENCY LIMITED|similar agency address,similar agency email
3704|Big Big Employment Agency|similar agency address
3722|F & P Employment Services Limited|similar agency address,similar money lender address
3728|WING MING EMPLOYMENT SERVICES|similar agency telephone
3761|Happy Heart Employment Center|similar agency address,similar money lender address
3768|A&G; EMPLOYMENT CENTRE|similar agency address,similar agency telephone,similar agency fax
3770|Prosperity Employment Centre|similar agency address
3787|Excel Famous Domestic Helper Consultant Limited|similar agency telephone,similar agency email
3796|ZENTRALINK MAID CONSULTANT|similar agency address,similar money lender address
3799|Wing Fu Yu Employment Agency Limited|similar agency address,similar agency telephone,similar agency fax
3835|GOLDEN OCEAN EMPLOYMENT COMPANY|similar money lender address
3847|Grand Bee Trade Plus|similar agency address,similar agency fax
3849|Sunlight Employment Agency|similar agency address
3851|Bandung Enterprises|similar agency address,similar money lender address
3858|FUK HONG EMPLOYMENT CENTRE LIMITED|similar agency address
3859|TOP ONE EMPLOYMENT AGENCY|similar agency address
3877|Gary's Employment Agency Company Limited|similar agency address,similar agency fax
3880|Graceful Heart Agency Limited|similar agency address
3883|CANLIX EMPLOYMENT CENTRE|exact agency address,similar agency address
3886|LT Domestic Helper Agency Limited|similar agency address,similar agency telephone,similar agency fax
3890|JIM CITY EMPLOYMENT AGENCY|exact agency address,similar agency fax
3892|Darren Maid Service|similar agency address
3893|STARRY EMPLOYMENT SERVICES COMPANY|similar agency address
3897|Snow Employment & Travel Centre|similar agency fax
3915|Helpers Market International Recruitment Limited|exact agency address,similar agency telephone
3919|Asian Developing Talent|exact agency address,similar agency address
3950|Ming Hin Domestic Helper Agency|similar agency address
3959|BTI COURIER EXPRESS|exact agency address,similar agency telephone,similar agency fax
3960|A & W EMPLOYMENT SERVICES CENTRE|similar agency address,similar money lender address
3962|FULLY HUMAN RESOURCE AGENCY COMPANY|exact agency address,similar agency address,similar agency fax
3978|WING MING EMPLOYMENT SERVICES|similar agency telephone
3984|Ceylon Employment Agency Limited|exact agency address,similar agency address
3998|GRAND WINNERS EMPLOYMENT CENTRE|exact agency address,similar agency address,similar agency fax,similar money lender address
4007|PRITZ EMPLOYMENT AGENCY|similar agency address,similar money lender address
4012|Grand Royal (AFT) Employment|similar agency fax,similar agency email
4013|Grand Royal (AFT) Employment|similar agency address,similar agency telephone,similar agency fax,similar agency email
4014|REMARKABLE EMPLOYMENT CENTRE|similar agency email
4015|PEACEFUL COMPANY|similar agency address,similar agency telephone,similar agency email
4038|BRIGHT STAR EMPLOYMENT AGENCY|similar agency address
4048|MACKEY EMPLOYMENT AGENCY|similar agency address,similar money lender address
4055|Onon Agency Limited|exact agency address,similar agency address
4059|J Rich Employment Agency Co. Limited|similar agency address
4062|Elise Consultant|similar agency address
4063|Ensemble Human Resources Co. Limited|similar agency address,similar agency telephone,similar agency fax,similar agency email
4064|THE ONE HELPER AGENCY|similar agency address,similar agency telephone,similar agency fax
4081|SinoFilipino Company Limited|similar agency address,similar money lender address
4087|Live-in Seedling Employment Service Co.|similar agency telephone,similar agency fax,similar money lender address
4109|INDO INDAH EMPLOYMENT AGENCY|similar agency address,similar agency telephone,similar agency fax
4117|PILIPINO OVERSEAS WORKERS CLUB LIMITED|similar agency address,similar agency email
4119|U.A. EMPLOYMENT CENTER|exact agency address,similar agency address,similar agency fax
4121|Helperspro Employment Agency Limited|exact agency address,similar agency address,similar agency email
4132|R JOB LIMITED|similar agency address,similar agency telephone,similar agency fax
4154|SHINING HOME EMPLOYMENT AGENCY LIMITED|similar money lender address
4156|TOKO-OK EMPLOYMENT AGENCY|similar agency address
4163|WITH HEART EMPLOYMENT AGENCY LIMITED|similar money lender address
4165|Advantage Consultant Co.|similar agency address,similar agency fax,similar money lender address
4166|Liberty Employment Agency|similar agency address,similar agency telephone,similar agency fax,similar money lender address
4167|HOME CARE EMPLOYMENT AGENCY LIMITED|similar agency address,similar money lender address
4191|Jame Employment Agencies Centre|exact agency address,similar agency email
4193|CAPITAL SUN EMPLOYMENT CENTRE|similar agency address,similar money lender address
4215|Abadi Employment Consultant Centre|similar agency address,similar money lender address
4216|WARM HOUSE EMPLOYMENT SERVICES CENTRE LIMITED|similar agency address,similar agency telephone,similar agency fax,similar agency email
4217|WING MING EMPLOYMENT SERVICES|similar agency address,similar agency telephone,similar agency email
4218|WING MING EMPLOYMENT SERVICES|similar agency telephone,similar agency email
4219|WING MING EMPLOYMENT SERVICES|similar agency telephone,similar agency email
4221|JobsMart Asia|similar agency email,similar money lender address
4222|JobsMart Asia|similar agency address,similar agency email
4245|Serious Employment Centre Limited|exact agency address,similar money lender address
57|Ivy's Agency (H.K.)|similar agency telephone,similar agency fax,similar agency email
